### ISSUE TITLE
not getting response back to client if i pass some http header for url rewrite through reverse proxy

### ISSUE THREAD

**Issue by abijoshi** [corsis/PortFusion#2]
Hi,
I am using portfusion 0.9.3 and using it, i am able to connect to my server through DMZ network machine with below commands:
HM> PortFusionHost.exe 1080
SERVER> PortFusionClient 1080 HM 5010=localhost:8000

Then i try to do GET through my REST client and it works perfectly and provides me needed data. When i pass HTTP header for some URL rewrite which my application is accepting and providing data back, is taking more then 3-4 minutes for data to reach REST client.

I captured WireShark on port 5010 and collected following readings

No.     Time        Source                Destination           Protocol Length Info
      1 0.000000    CLIENT_IP          DMZ_HOST         TCP      90     S+*, 22923 > telelpathstart [SYN] Seq=0 Win=5840 Len=0 MSS=1460 SACK_PERM=1 TSval=2623342922 TSecr=0 WS=4

Frame 1: 90 bytes on wire (720 bits), 90 bytes captured (720 bits)
Ethernet II, Src: Cisco_a2:41:00 (88:43:e1:a2:41:00), Dst: Vmware_8f:09:12 (00:50:56:8f:09:12)
Internet Protocol Version 4, Src: CLIENT_IP (CLIENT_IP), Dst: DMZ_HOST (DMZ_HOST)
Transmission Control Protocol, Src Port: 22923 (22923), Dst Port: telelpathstart (5010), Seq: 0, Len: 0

No.     Time        Source                Destination           Protocol Length Info
      2 0.000076    DMZ_HOST         CLIENT_IP          TCP      66     telelpathstart > 22923 [SYN, ACK] Seq=0 Ack=1 Win=65535 Len=0 SACK_PERM=1 TSval=377453560 TSecr=2623342922

Frame 2: 66 bytes on wire (528 bits), 66 bytes captured (528 bits)
Ethernet II, Src: Vmware_8f:09:12 (00:50:56:8f:09:12), Dst: All-HSRP-routers_c9 (00:00:0c:07:ac:c9)
Internet Protocol Version 4, Src: DMZ_HOST (DMZ_HOST), Dst: CLIENT_IP (CLIENT_IP)
Transmission Control Protocol, Src Port: telelpathstart (5010), Dst Port: 22923 (22923), Seq: 0, Ack: 1, Len: 0

No.     Time        Source                Destination           Protocol Length Info
      3 0.002178    CLIENT_IP          DMZ_HOST         TCP      66     22923 > telelpathstart [ACK] Seq=1 Ack=1 Win=5840 Len=0 TSval=2623342925 TSecr=377453560

Frame 3: 66 bytes on wire (528 bits), 66 bytes captured (528 bits)
Ethernet II, Src: Cisco_a2:41:00 (88:43:e1:a2:41:00), Dst: Vmware_8f:09:12 (00:50:56:8f:09:12)
Internet Protocol Version 4, Src: CLIENT_IP (CLIENT_IP), Dst: DMZ_HOST (DMZ_HOST)
Transmission Control Protocol, Src Port: 22923 (22923), Dst Port: telelpathstart (5010), Seq: 1, Ack: 1, Len: 0

No.     Time        Source                Destination           Protocol Length Info
      4 0.415423    CLIENT_IP          DMZ_HOST         IPSICTL  275    Initialization

Frame 4: 275 bytes on wire (2200 bits), 275 bytes captured (2200 bits)
Ethernet II, Src: Cisco_a2:41:00 (88:43:e1:a2:41:00), Dst: Vmware_8f:09:12 (00:50:56:8f:09:12)
Internet Protocol Version 4, Src: CLIENT_IP (CLIENT_IP), Dst: DMZ_HOST (DMZ_HOST)
Transmission Control Protocol, Src Port: 22923 (22923), Dst Port: telelpathstart (5010), Seq: 1, Ack: 1, Len: 209
IPSICTL

No.     Time        Source                Destination           Protocol Length Info
      5 0.616818    DMZ_HOST         CLIENT_IP          TCP      66     telelpathstart > 22923 [ACK] Seq=1 Ack=210 Win=65535 Len=0 TSval=377453622 TSecr=2623343338

Frame 5: 66 bytes on wire (528 bits), 66 bytes captured (528 bits)
Ethernet II, Src: Vmware_8f:09:12 (00:50:56:8f:09:12), Dst: All-HSRP-routers_c9 (00:00:0c:07:ac:c9)
Internet Protocol Version 4, Src: DMZ_HOST (DMZ_HOST), Dst: CLIENT_IP (CLIENT_IP)
Transmission Control Protocol, Src Port: telelpathstart (5010), Dst Port: 22923 (22923), Seq: 1, Ack: 210, Len: 0

No.     Time        Source                Destination           Protocol Length Info
      6 1.444167    DMZ_HOST         CLIENT_IP          IPSICTL  1114   Initialization

Frame 6: 1114 bytes on wire (8912 bits), 1114 bytes captured (8912 bits)
Ethernet II, Src: Vmware_8f:09:12 (00:50:56:8f:09:12), Dst: All-HSRP-routers_c9 (00:00:0c:07:ac:c9)
Internet Protocol Version 4, Src: DMZ_HOST (DMZ_HOST), Dst: CLIENT_IP (CLIENT_IP)
Transmission Control Protocol, Src Port: telelpathstart (5010), Dst Port: 22923 (22923), Seq: 1, Ack: 210, Len: 1048
IPSICTL

No.     Time        Source                Destination           Protocol Length Info
      7 1.445380    CLIENT_IP          DMZ_HOST         TCP      66     22923 > telelpathstart [ACK] Seq=210 Ack=525 Win=6812 Len=0 TSval=2623344368 TSecr=377453705

Frame 7: 66 bytes on wire (528 bits), 66 bytes captured (528 bits)
Ethernet II, Src: Cisco_a2:41:00 (88:43:e1:a2:41:00), Dst: Vmware_8f:09:12 (00:50:56:8f:09:12)
Internet Protocol Version 4, Src: CLIENT_IP (CLIENT_IP), Dst: DMZ_HOST (DMZ_HOST)
Transmission Control Protocol, Src Port: 22923 (22923), Dst Port: telelpathstart (5010), Seq: 210, Ack: 525, Len: 0

No.     Time        Source                Destination           Protocol Length Info
      8 1.445382    CLIENT_IP          DMZ_HOST         TCP      66     22923 > telelpathstart [ACK] Seq=210 Ack=1049 Win=7860 Len=0 TSval=2623344368 TSecr=377453705

Frame 8: 66 bytes on wire (528 bits), 66 bytes captured (528 bits)
Ethernet II, Src: Cisco_a2:41:00 (88:43:e1:a2:41:00), Dst: Vmware_8f:09:12 (00:50:56:8f:09:12)
Internet Protocol Version 4, Src: CLIENT_IP (CLIENT_IP), Dst: DMZ_HOST (DMZ_HOST)
Transmission Control Protocol, Src Port: 22923 (22923), Dst Port: telelpathstart (5010), Seq: 210, Ack: 1049, Len: 0

No.     Time        Source                Destination           Protocol Length Info
      9 1.445431    DMZ_HOST         CLIENT_IP          IPSICTL  2162   Initialization

Frame 9: 2162 bytes on wire (17296 bits), 2162 bytes captured (17296 bits)
Ethernet II, Src: Vmware_8f:09:12 (00:50:56:8f:09:12), Dst: All-HSRP-routers_c9 (00:00:0c:07:ac:c9)
Internet Protocol Version 4, Src: DMZ_HOST (DMZ_HOST), Dst: CLIENT_IP (CLIENT_IP)
Transmission Control Protocol, Src Port: telelpathstart (5010), Dst Port: 22923 (22923), Seq: 1049, Ack: 210, Len: 2096
IPSICTL

No.     Time        Source                Destination           Protocol Length Info
     10 1.446577    CLIENT_IP          DMZ_HOST         TCP      66     22923 > telelpathstart [ACK] Seq=210 Ack=1573 Win=8908 Len=0 TSval=2623344369 TSecr=377453705

Frame 10: 66 bytes on wire (528 bits), 66 bytes captured (528 bits)
Ethernet II, Src: Cisco_a2:41:00 (88:43:e1:a2:41:00), Dst: Vmware_8f:09:12 (00:50:56:8f:09:12)
Internet Protocol Version 4, Src: CLIENT_IP (CLIENT_IP), Dst: DMZ_HOST (DMZ_HOST)
Transmission Control Protocol, Src Port: 22923 (22923), Dst Port: telelpathstart (5010), Seq: 210, Ack: 1573, Len: 0

No.     Time        Source                Destination           Protocol Length Info
     11 1.446580    CLIENT_IP          DMZ_HOST         TCP      66     22923 > telelpathstart [ACK] Seq=210 Ack=2097 Win=9956 Len=0 TSval=2623344369 TSecr=377453705

Frame 11: 66 bytes on wire (528 bits), 66 bytes captured (528 bits)
Ethernet II, Src: Cisco_a2:41:00 (88:43:e1:a2:41:00), Dst: Vmware_8f:09:12 (00:50:56:8f:09:12)
Internet Protocol Version 4, Src: CLIENT_IP (CLIENT_IP), Dst: DMZ_HOST (DMZ_HOST)
Transmission Control Protocol, Src Port: 22923 (22923), Dst Port: telelpathstart (5010), Seq: 210, Ack: 2097, Len: 0

No.     Time        Source                Destination           Protocol Length Info
     12 1.446582    CLIENT_IP          DMZ_HOST         TCP      66     22923 > telelpathstart [ACK] Seq=210 Ack=2621 Win=11004 Len=0 TSval=2623344369 TSecr=377453705

Frame 12: 66 bytes on wire (528 bits), 66 bytes captured (528 bits)
Ethernet II, Src: Cisco_a2:41:00 (88:43:e1:a2:41:00), Dst: Vmware_8f:09:12 (00:50:56:8f:09:12)
Internet Protocol Version 4, Src: CLIENT_IP (CLIENT_IP), Dst: DMZ_HOST (DMZ_HOST)
Transmission Control Protocol, Src Port: 22923 (22923), Dst Port: telelpathstart (5010), Seq: 210, Ack: 2621, Len: 0

No.     Time        Source                Destination           Protocol Length Info
     13 1.446584    CLIENT_IP          DMZ_HOST         TCP      66     22923 > telelpathstart [ACK] Seq=210 Ack=3145 Win=12052 Len=0 TSval=2623344369 TSecr=377453705

Frame 13: 66 bytes on wire (528 bits), 66 bytes captured (528 bits)
Ethernet II, Src: Cisco_a2:41:00 (88:43:e1:a2:41:00), Dst: Vmware_8f:09:12 (00:50:56:8f:09:12)
Internet Protocol Version 4, Src: CLIENT_IP (CLIENT_IP), Dst: DMZ_HOST (DMZ_HOST)
Transmission Control Protocol, Src Port: 22923 (22923), Dst Port: telelpathstart (5010), Seq: 210, Ack: 3145, Len: 0

No.     Time        Source                Destination           Protocol Length Info
     14 1.446638    DMZ_HOST         CLIENT_IP          IPSICTL  465    Initialization

Frame 14: 465 bytes on wire (3720 bits), 465 bytes captured (3720 bits)
Ethernet II, Src: Vmware_8f:09:12 (00:50:56:8f:09:12), Dst: All-HSRP-routers_c9 (00:00:0c:07:ac:c9)
Internet Protocol Version 4, Src: DMZ_HOST (DMZ_HOST), Dst: CLIENT_IP (CLIENT_IP)
Transmission Control Protocol, Src Port: telelpathstart (5010), Dst Port: 22923 (22923), Seq: 3145, Ack: 210, Len: 399
IPSICTL

No.     Time        Source                Destination           Protocol Length Info
     15 1.447726    CLIENT_IP          DMZ_HOST         TCP      66     22923 > telelpathstart [ACK] Seq=210 Ack=3544 Win=13100 Len=0 TSval=2623344370 TSecr=377453705

Frame 15: 66 bytes on wire (528 bits), 66 bytes captured (528 bits)
Ethernet II, Src: Cisco_a2:41:00 (88:43:e1:a2:41:00), Dst: Vmware_8f:09:12 (00:50:56:8f:09:12)
Internet Protocol Version 4, Src: CLIENT_IP (CLIENT_IP), Dst: DMZ_HOST (DMZ_HOST)
Transmission Control Protocol, Src Port: 22923 (22923), Dst Port: telelpathstart (5010), Seq: 210, Ack: 3544, Len: 0

No.     Time        Source                Destination           Protocol Length Info
     16 301.428842  CLIENT_IP          DMZ_HOST         TCP      66     [TCP Keep-Alive] 22923 > telelpathstart [ACK] Seq=209 Ack=3544 Win=13100 Len=0 TSval=2623644370 TSecr=377453705

Frame 16: 66 bytes on wire (528 bits), 66 bytes captured (528 bits)
Ethernet II, Src: Cisco_a2:41:00 (88:43:e1:a2:41:00), Dst: Vmware_8f:09:12 (00:50:56:8f:09:12)
Internet Protocol Version 4, Src: CLIENT_IP (CLIENT_IP), Dst: DMZ_HOST (DMZ_HOST)
Transmission Control Protocol, Src Port: 22923 (22923), Dst Port: telelpathstart (5010), Seq: 209, Ack: 3544, Len: 0

No.     Time        Source                Destination           Protocol Length Info
     17 301.428892  DMZ_HOST         CLIENT_IP          TCP      66     [TCP Keep-Alive ACK] telelpathstart > 22923 [ACK] Seq=3544 Ack=210 Win=65535 Len=0 TSval=377483703 TSecr=2623344370

Frame 17: 66 bytes on wire (528 bits), 66 bytes captured (528 bits)
Ethernet II, Src: Vmware_8f:09:12 (00:50:56:8f:09:12), Dst: All-HSRP-routers_c9 (00:00:0c:07:ac:c9)
Internet Protocol Version 4, Src: DMZ_HOST (DMZ_HOST), Dst: CLIENT_IP (CLIENT_IP)
Transmission Control Protocol, Src Port: telelpathstart (5010), Dst Port: 22923 (22923), Seq: 3544, Ack: 210, Len: 0

No.     Time        Source                Destination           Protocol Length Info
     18 601.414158  CLIENT_IP          DMZ_HOST         TCP      66     [TCP Keep-Alive] 22923 > telelpathstart [ACK] Seq=209 Ack=3544 Win=13100 Len=0 TSval=2623944373 TSecr=377483703

Frame 18: 66 bytes on wire (528 bits), 66 bytes captured (528 bits)
Ethernet II, Src: Cisco_a2:41:00 (88:43:e1:a2:41:00), Dst: Vmware_8f:09:12 (00:50:56:8f:09:12)
Internet Protocol Version 4, Src: CLIENT_IP (CLIENT_IP), Dst: DMZ_HOST (DMZ_HOST)
Transmission Control Protocol, Src Port: 22923 (22923), Dst Port: telelpathstart (5010), Seq: 209, Ack: 3544, Len: 0

No.     Time        Source                Destination           Protocol Length Info
     19 601.414206  DMZ_HOST         CLIENT_IP          TCP      66     [TCP Keep-Alive ACK] telelpathstart > 22923 [ACK] Seq=3544 Ack=210 Win=65535 Len=0 TSval=377513702 TSecr=2623344370

Frame 19: 66 bytes on wire (528 bits), 66 bytes captured (528 bits)
Ethernet II, Src: Vmware_8f:09:12 (00:50:56:8f:09:12), Dst: All-HSRP-routers_c9 (00:00:0c:07:ac:c9)
Internet Protocol Version 4, Src: DMZ_HOST (DMZ_HOST), Dst: CLIENT_IP (CLIENT_IP)
Transmission Control Protocol, Src Port: telelpathstart (5010), Dst Port: 22923 (22923), Seq: 3544, Ack: 210, Len: 0

Please let me know if something you can help me here.
